{
  "schemaVersion": 1,
  "id": "components-demo",
  "title": "Component examples: charts, tables, code, icons, arrows",
  "theme": "ink-paper",
  "canvas": { "width": 1920, "height": 1080 },
  "slides": [
    {
      "id": "s1",
      "layout": "hero",
      "slots": {
        "brand": { "type": "text", "value": "Component examples" },
        "meta": { "type": "text", "value": "2026-09" },
        "kicker": { "type": "text", "value": "Layouts, batch three" },
        "title": { "type": "text", "value": "Data can go *straight on stage*" },
        "subtitle": { "type": "text", "value": "Charts, tables, code and icons are editable components: move and scale the whole block, change the content as multi-line text." },
        "stat-1": { "type": "metric", "value": "4", "label": "new slot types" },
        "stat-2": { "type": "metric", "value": "9", "label": "layouts that use them" },
        "stat-3": { "type": "metric", "value": "77", "label": "built-in icons" },
        "page": { "type": "text", "value": "01 / 07" }
      },
      "elements": [
        { "id": "glow", "kind": "shape" },
        { "id": "corner-tl", "kind": "shape" },
        { "id": "corner-br", "kind": "shape" },
        { "id": "brand", "kind": "text" },
        { "id": "meta", "kind": "text" },
        { "id": "anchor", "kind": "shape" },
        { "id": "kicker", "kind": "text" },
        { "id": "title", "kind": "text" },
        { "id": "subtitle", "kind": "text" },
        { "id": "stat-1", "kind": "text" },
        { "id": "stat-2", "kind": "text" },
        { "id": "stat-3", "kind": "text" },
        { "id": "page", "kind": "text" }
      ]
    },
    {
      "id": "s2",
      "layout": "chart-aside",
      "slots": {
        "brand": { "type": "text", "value": "Component examples" },
        "meta": { "type": "text", "value": "2026-09" },
        "title": { "type": "text", "value": "Sixteen rounds of layout revision, eleven caused by content order" },
        "chart": {
          "type": "chart",
          "kind": "bar",
          "unit": " rounds",
          "series": [
            { "label": "Order changed", "value": 11 },
            { "label": "Type and pictures", "value": 3 },
            { "label": "Colours and fonts", "value": 2 }
          ]
        },
        "aside": { "type": "metric", "value": "69%", "label": "of layout revisions were really order problems", "delta": "11 / 16 rounds" },
        "caption": { "type": "text", "value": "A round-by-round log of six decks and twenty-four rounds of revision last quarter." },
        "page": { "type": "text", "value": "02 / 07" }
      },
      "elements": [
        { "id": "brand", "kind": "text" },
        { "id": "meta", "kind": "text" },
        { "id": "title", "kind": "text" },
        { "id": "chart", "kind": "text" },
        { "id": "aside", "kind": "text" },
        { "id": "caption", "kind": "text" },
        { "id": "page", "kind": "text" }
      ]
    },
    {
      "id": "s3",
      "layout": "chart-aside",
      "slots": {
        "brand": { "type": "text", "value": "Component examples" },
        "meta": { "type": "text", "value": "2026-09" },
        "title": { "type": "text", "value": "Revision rounds fall quarter by quarter" },
        "chart": {
          "type": "chart",
          "kind": "line",
          "series": [
            { "label": "Q1", "value": 5 },
            { "label": "Q2", "value": 4 },
            { "label": "Q3", "value": 4 },
            { "label": "Trial", "value": 0 }
          ]
        },
        "aside": { "type": "chart", "kind": "donut", "unit": "%", "series": [{ "label": "Layout revisions at zero", "value": 100 }] },
        "caption": { "type": "text", "value": "The line is the average rounds of revision per quarter; the ring is how many of the two trial decks got there." },
        "page": { "type": "text", "value": "03 / 07" }
      },
      "elements": [
        { "id": "brand", "kind": "text" },
        { "id": "meta", "kind": "text" },
        { "id": "title", "kind": "text" },
        { "id": "chart", "kind": "text" },
        { "id": "aside", "kind": "text" },
        { "id": "caption", "kind": "text" },
        { "id": "page", "kind": "text" }
      ]
    },
    {
      "id": "s4",
      "layout": "data-table",
      "slots": {
        "brand": { "type": "text", "value": "Component examples" },
        "meta": { "type": "text", "value": "2026-09" },
        "title": { "type": "text", "value": "Of six decks, only one was not an order problem" },
        "table": {
          "type": "table",
          "header": ["Deck", "Rounds", "Order-related", "Layout-related", "Note"],
          "rows": [
            ["Q1 results review", "5", "4", "1", "Agenda changed 3 times"],
            ["New product proposal", "4", "3", "1", ""],
            ["Quarterly OKRs", "3", "2", "1", ""],
            ["Customer case study", "4", "1", "3", "The *only* layout-led one"],
            ["Annual budget", "5", "4", "1", "Chapter order swapped"]
          ]
        },
        "caption": { "type": "text", "value": "A round-by-round log of six decks and twenty-four rounds of revision last quarter." },
        "page": { "type": "text", "value": "04 / 07" }
      },
      "elements": [
        { "id": "brand", "kind": "text" },
        { "id": "meta", "kind": "text" },
        { "id": "title", "kind": "text" },
        { "id": "table", "kind": "text" },
        { "id": "caption", "kind": "text" },
        { "id": "page", "kind": "text" }
      ]
    },
    {
      "id": "s5",
      "layout": "icon-cards",
      "slots": {
        "brand": { "type": "text", "value": "Component examples" },
        "meta": { "type": "text", "value": "2026-09" },
        "title": { "type": "text", "value": "Three things the new workflow protects" },
        "card-1": { "type": "text", "value": "No slide is generated before the story is confirmed." },
        "card-2": { "type": "text", "value": "Three visual directions are chosen from real covers, not from adjectives." },
        "card-3": { "type": "text", "value": "Regenerating a slide always keeps the manual edits." },
        "icon-1": { "type": "icon", "name": "shield-check" },
        "icon-2": { "type": "icon", "name": "eye" },
        "icon-3": { "type": "icon", "name": "refresh-cw" },
        "page": { "type": "text", "value": "05 / 07" }
      },
      "elements": [
        { "id": "brand", "kind": "text" },
        { "id": "meta", "kind": "text" },
        { "id": "title", "kind": "text" },
        { "id": "card-1", "kind": "text" },
        { "id": "card-2", "kind": "text" },
        { "id": "card-3", "kind": "text" },
        { "id": "icon-1", "kind": "text" },
        { "id": "icon-2", "kind": "text" },
        { "id": "icon-3", "kind": "text" },
        { "id": "page", "kind": "text" }
      ]
    },
    {
      "id": "s6",
      "layout": "code-block",
      "slots": {
        "brand": { "type": "text", "value": "Component examples" },
        "meta": { "type": "text", "value": "2026-09" },
        "title": { "type": "text", "value": "The gate is enforced by the tool, not by memory" },
        "code": {
          "type": "code",
          "lang": "bash",
          "value": "$ pnpm story:check decks/q3/story.md\npassed: 0 errors, 0 warnings\n\n$ pnpm deck:scaffold decks/q3/story.md --theme ink-paper\nnot confirmed: show the user the per-slide summary first, then run pnpm story:confirm once they agree\n\n$ pnpm story:confirm decks/q3/story.md\nconfirmation recorded: decks/q3/story.confirmed.json (8 slides, sha256 edce99f4)"
        },
        "caption": { "type": "text", "value": "When the story is unconfirmed or has changed, the generate command refuses outright." },
        "page": { "type": "text", "value": "06 / 07" }
      },
      "elements": [
        { "id": "brand", "kind": "text" },
        { "id": "meta", "kind": "text" },
        { "id": "title", "kind": "text" },
        { "id": "code", "kind": "text" },
        { "id": "caption", "kind": "text" },
        { "id": "page", "kind": "text" }
      ]
    },
    {
      "id": "s7",
      "layout": "before-after",
      "slots": {
        "brand": { "type": "text", "value": "Component examples" },
        "meta": { "type": "text", "value": "2026-09" },
        "title": { "type": "text", "value": "Move the story confirmation ahead of the layout" },
        "before-label": { "type": "text", "value": "Today" },
        "after-label": { "type": "text", "value": "New workflow" },
        "before": { "type": "list", "items": ["Open the app, pick a template first", "Pour the content into the layout", "Present once, notice the order is wrong", "Lay out again, present again"] },
        "after": { "type": "list", "items": ["Write the story document", "*You confirm* the order and the messages", "Generate the layout", "Fine-tune the text only"] },
        "page": { "type": "text", "value": "07 / 07" }
      },
      "elements": [
        { "id": "brand", "kind": "text" },
        { "id": "meta", "kind": "text" },
        { "id": "title", "kind": "text" },
        { "id": "before-label", "kind": "text" },
        { "id": "after-label", "kind": "text" },
        { "id": "before", "kind": "text" },
        { "id": "arrow", "kind": "shape" },
        { "id": "after", "kind": "text" },
        { "id": "page", "kind": "text" }
      ]
    }
  ],
  "overrides": {
    "s2/chart": { "text": "Order changed|11\nType and pictures|3\nColours and fonts|2\nOther|0" }
  }
}
