{
  "schemaVersion": 1,
  "id": "story-first",
  "title": "Confirm the story before the slides",
  "theme": "ink-paper",
  "canvas": {
    "width": 1920,
    "height": 1080
  },
  "story": {
    "path": "story.sample.md",
    "sha256": "448edc1b66b2dabf9ef51721ffd4475eb1f17707f86c594cc0dd0ce493306b3e"
  },
  "slides": [
    {
      "id": "s1",
      "layout": "cover",
      "slots": {
        "kicker": {
          "type": "text",
          "value": "Weekly proposal"
        },
        "title": {
          "type": "text",
          "value": "Where our slide revisions go"
        },
        "subtitle": {
          "type": "text",
          "value": "Last quarter six decks averaged four rounds of revision, three of which touched only the layout."
        }
      },
      "elements": [
        {
          "id": "backdrop",
          "kind": "shape"
        },
        {
          "id": "kicker",
          "kind": "text"
        },
        {
          "id": "title",
          "kind": "text"
        },
        {
          "id": "subtitle",
          "kind": "text"
        }
      ],
      "notes": "Open with a question: the last time you revised a deck, was it the content or the layout? Hold three seconds before moving on."
    },
    {
      "id": "s2",
      "layout": "cards",
      "slots": {
        "title": {
          "type": "text",
          "value": "Three things today"
        },
        "card-1": {
          "type": "text",
          "value": "Why the layout keeps changing"
        },
        "card-2": {
          "type": "text",
          "value": "What the new workflow looks like"
        },
        "card-3": {
          "type": "text",
          "value": "Next week's trial plan"
        }
      },
      "elements": [
        {
          "id": "title",
          "kind": "text"
        },
        {
          "id": "card-1",
          "kind": "text"
        },
        {
          "id": "card-2",
          "kind": "text"
        },
        {
          "id": "card-3",
          "kind": "text"
        }
      ],
      "notes": "Stay on this slide for ten seconds only, just long enough to show the structure."
    },
    {
      "id": "s3",
      "layout": "statement",
      "slots": {
        "title": {
          "type": "text",
          "value": "The truth about revision rounds"
        },
        "body": {
          "type": "text",
          "value": "Of three layout rounds, two came from a content order change midway."
        },
        "evidence": {
          "type": "list",
          "items": [
            "A round-by-round log of six decks and twenty-four rounds of revision",
            "Sixteen rounds concerned the layout; eleven began with a change in content order"
          ]
        }
      },
      "elements": [
        {
          "id": "title",
          "kind": "text"
        },
        {
          "id": "body",
          "kind": "text"
        },
        {
          "id": "evidence",
          "kind": "text"
        }
      ],
      "notes": "Stress that \"the layout got changed\" is the result, not the cause."
    },
    {
      "id": "s4",
      "layout": "comparison",
      "slots": {
        "title": {
          "type": "text",
          "value": "The tool is fine, the order is wrong"
        },
        "left-title": {
          "type": "text",
          "value": "Today"
        },
        "left-items": {
          "type": "list",
          "items": [
            "open the slide app",
            "lay out",
            "present once",
            "notice the order is wrong",
            "lay out again"
          ]
        },
        "right-title": {
          "type": "text",
          "value": "Goal"
        },
        "right-items": {
          "type": "list",
          "items": [
            "write the story",
            "confirm",
            "generate the layout",
            "fine-tune only"
          ]
        }
      },
      "elements": [
        {
          "id": "title",
          "kind": "text"
        },
        {
          "id": "divider",
          "kind": "shape"
        },
        {
          "id": "left-title",
          "kind": "text"
        },
        {
          "id": "left-items",
          "kind": "text"
        },
        {
          "id": "right-title",
          "kind": "text"
        },
        {
          "id": "right-items",
          "kind": "text"
        }
      ],
      "notes": "Let the two columns speak for themselves; do not read them out."
    },
    {
      "id": "s5",
      "layout": "statement",
      "slots": {
        "title": {
          "type": "text",
          "value": "The five steps of the new workflow"
        },
        "body": {
          "type": "text",
          "value": "brief -> story document (you confirm it) -> visual direction -> generate -> edit in the browser"
        }
      },
      "elements": [
        {
          "id": "title",
          "kind": "text"
        },
        {
          "id": "body",
          "kind": "text"
        },
        {
          "id": "evidence",
          "kind": "text"
        }
      ],
      "notes": "Point out that \"you confirm it\" is the only step where a person has to stop."
    },
    {
      "id": "s6",
      "layout": "cards",
      "slots": {
        "title": {
          "type": "text",
          "value": "Two trial decks, zero rounds of layout revision"
        },
        "card-1": {
          "type": "metric",
          "value": "0",
          "label": "Layout revisions, trial A",
          "delta": "two rounds on the story"
        },
        "card-2": {
          "type": "metric",
          "value": "0",
          "label": "Layout revisions, trial B",
          "delta": "one round on the story"
        }
      },
      "elements": [
        {
          "id": "title",
          "kind": "text"
        },
        {
          "id": "card-1",
          "kind": "text"
        },
        {
          "id": "card-2",
          "kind": "text"
        },
        {
          "id": "card-3",
          "kind": "text"
        }
      ],
      "notes": "This is the peak slide: make the numbers big and stay on it longer."
    },
    {
      "id": "s7",
      "layout": "statement",
      "slots": {
        "title": {
          "type": "text",
          "value": "The last time you revised a deck, was it the content or the layout?"
        }
      },
      "elements": [
        {
          "id": "title",
          "kind": "text"
        },
        {
          "id": "body",
          "kind": "text"
        },
        {
          "id": "evidence",
          "kind": "text"
        }
      ],
      "notes": "Say nothing; wait three to five seconds."
    },
    {
      "id": "s8",
      "layout": "closing",
      "slots": {
        "title": {
          "type": "text",
          "value": "Make a real one next week"
        },
        "body": {
          "type": "text",
          "value": "Make one real proposal this way and review it together."
        },
        "cta": {
          "type": "text",
          "value": "One volunteer to provide the topic"
        }
      },
      "elements": [
        {
          "id": "backdrop",
          "kind": "shape"
        },
        {
          "id": "title",
          "kind": "text"
        },
        {
          "id": "body",
          "kind": "text"
        },
        {
          "id": "cta",
          "kind": "text"
        }
      ],
      "notes": "Ask directly who will provide the topic and settle it on the spot."
    }
  ],
  "overrides": {
    "s1/title": {
      "y": 360,
      "style": {
        "fontSize": 128
      }
    },
    "s6/card-1": {
      "style": {
        "color": "#c8102e",
        "fontSize": 160
      }
    },
    "s6/card-3": {
      "hidden": true
    }
  }
}
